unsullied,NA,alive,NA,NA,NA,NA,summer isles,unsullied : house targaryen,summer islander,NA,NA,NA,NA,missandei,jacob anderson,grey worm,grey,torgo nudho hokas bezy sa me broji beri ji broji ez bezo sene stas qimbroto kuny iles ji broji meles esko mazedhas derari va buzdar y torgo nudho sa ji broji ez bezy eji tovi daenerys jelmazmo ji teptas ji derve grey worm gives this one pride it is a lucky name the name this one was born with was cursed that was the name he had when he was taken as a slave but grey worm is the name this one had the day daenerys stormborn set him free : bezy eza ji rigle this one has the honor : nya dare beza unehtelas jaa engo ozy my queen shall this one slice out his tongue for you,season three appearances : valar dohaeris : dark wings dark words : walk of punishment : and now his watch is ended : kissed by fire : the climb : the bear and the maiden fair : second sons : the rains of castamere : mhysa : season four appearances : two swords : the lion and the rose : breaker of chains : oathkeeper : first of his name : the laws of gods and men : mockingbird : the mountain and the viper : the watchers on the wall : the children : season five appearances : the wars to come : the house of black and white : high sparrow : sons of the harpy : kill the boy : unbowed unbent unbroken : the gift : hardhome : the dance of dragons : mothers mercy : season six appearances : the red woman : home : oathbreaker : book of the stranger : the door : blood of my blood : the broken man : no one : battle of the bastards : the winds of winter,NA,NA,NA,NA,NA,NA,NA,NA
NA,,alive,NA,NA,NA,NA,the arbor,house tyrell : house redwyne : house targaryen,andal,NA,NA,NA,viola redwyne,NA,diana rigg,olenna tyrell,olenna,cersei stole the future from me she killed my son she killed my grandson she killed my granddaughter survival is not what i m after now : loras is young and very good at knocking men off horses with a stick that does not make him wise as to your fathead father : grandmother what will sansa think of us : she might think we have some wits about us one of us at any rate : growing strong ha the dullest words of any house winter is coming now that s memorable we do not sow strong strong those houses you watch out for them direwolves and krakens fierce beasts but a golden rose growing strong oh yes that strikes fear in the heart : i was told you were drunk impertinent and thoroughly debauched you can imagine my disappointment at finding nothing but a browbeaten bookkeeper : we re at war lady olenna : oh i d nearly forgotten : yes and maintaining supply lines : i can t think how it slipped my mind what is it 12 000 infantrymen the tyrell family has supplied 1 800 mounted lances 2 000 in support provisions so this city might survive the winter a million bushels of wheat half a million bushels each of barley oats and rye 20 000 head of cattle 50 000 sheep you don t have to lecture me about wartime expenses i m quite familiar with them : you didn t think i d let you marry that beast did you : ah yes the famously tart tongued queen of thorns : and the famous tart queen cersei : you ve always been rather impressed with yourself haven t you : the past is the past the future is all that s worth discussing the future of house tyrell : don t pretend to have any concern for my house my grandchildren or me i should have known you d return to the capital as soon as things started to go wrong : i promise you : i promise you lord baelish that our fates are joined together we murdered a king if my house should fall i will have nothing to hide and if i should meet with some accident here at your broken little flesh market they ll never even find what s left of you : many will die no matter what we do better them than us : our two ancient houses face collapse because of your stupidity : what is your name again barbaro : obara : obara you look like an angry little boy don t presume to tell me what i need : forgive my sister what she lacks in diplomacy she makes : do shut up dear : anything from you :  : no good let the grown women speak : cersei stole the future from me she killed my son she killed my grandson she killed my granddaughter survival is not what i m after now,season three appearances : valar dohaeris : dark wings dark words : walk of punishment : and now his watch is ended : kissed by fire : the climb : the bear and the maiden fair : second sons : the rains of castamere : mhysa : season four appearances : two swords : the lion and the rose : breaker of chains : oathkeeper : first of his name : the laws of gods and men : mockingbird : the mountain and the viper : the watchers on the wall : the children : season five appearances : the wars to come : the house of black and white : high sparrow : sons of the harpy : kill the boy : unbowed unbent unbroken : the gift : hardhome : the dance of dragons : mothers mercy : season six appearances : the red woman : home : oathbreaker : book of the stranger : the door : blood of my blood : the broken man : no one : battle of the bastards : the winds of winter,luthor tyrell,NA,NA,mace tyrell,NA,NA,NA,NA
NA,NA,alive,NA,NA,NA,NA,hellholt,house martell : house uller : house targaryen,dornishmen,NA,lord uller,NA,NA,oberyn martell : paramour,indira varma,ellaria sand,ellaria,can t say i ve ever met a sand before : we are everywhere in dorne i have ten thousand brothers and sisters : you think i disapprove why because people disapprove of that sort of thing where you are from they disapproved of oberyn and me where you are from here no one blinked an eye a hundred years ago no one would have blinked an eye at you if you d been named targaryen it s always changing who we re supposed to love and who we re not the only thing that stays the same is we want who we want : why don t you use the right words i m a bastard and she is a whore : can t say i ve ever met a sand before : we are everywhere in dorne i have ten thousand brothers and sisters : you re going to fight that : i m going to kill that : don t leave me alone in this world : oberyn is dead and this lannister girl skips about the water gardens eating our food breathing our air : you must choose doran s way and peace or my way and war : no wonder you can t stand you have no spine : forgive me child i wish you all the happiness in the world : you have nothing to fear from us lady olenna : you murder your own prince yet you expect me to trust you : what is my heart s desire : vengeance justice : fire and blood : your mother is a brilliant woman you know that : the same women who murdered myrcella have overthrown house martell and taken control of dorne,season four appearances : two swords : the lion and the rose : breaker of chains : oathkeeper : first of his name : the laws of gods and men : mockingbird : the mountain and the viper : the watchers on the wall : the children : season five appearances : the wars to come : the house of black and white : high sparrow : sons of the harpy : kill the boy : unbowed unbent unbroken : the gift : hardhome : the dance of dragons : mothers mercy : season six appearances : the red woman : home : oathbreaker : book of the stranger : the door : blood of my blood : the broken man : no one : battle of the bastards : the winds of winter,NA,NA,NA,tyene sand : 1,NA,NA,NA,NA
NA,NA,NA,NA,NA,NA,NA,fourteen fires : valyrian peninsula : essos,NA,NA,NA,NA,NA,NA,NA,NA,dragons,dragons,when my dragons are grown we will take back what was stolen from me and destroy those who wronged me we will lay waste to armies and burn cities to the ground : zaldrzes buzdari iksos daor : they re dragons khaleesi they can never be tamed not even by their mother,,NA,NA,NA,NA,NA,NA,,bay of dragons : valyrian freehold : essos : worldwide
NA,,alive,NA,NA,NA,NA,evenfall hall,house tarth : house stark : kingsguard : renly i,andal,faith of the seven,selwyn tarth,NA,NA,NA,gwendoline christie,brienne of tarth,brienne,all my life men like you ve sneered at me and all my life i ve been knocking men like you into the dust : i m no lady : you coward one misfortune and you re giving up : misfortune : you lost your hand : my : hand i : that hand : you have a : one taste of the real world where people have important things taken from them and you whine and cry and quit you sound like a bloody woman : you need trust to have a truce : who taught you how to fight : my father : mine never wanted to said fighting was for boys : mine said the same but i kept fighting the boys anyway kept losing finally my father said if you re going to do this you may as well do it right : nothing s more hateful than failing to protect the one you love : in the name of renly of the house baratheon first of his name rightful king of the andals and the first men lord of the seven kingdoms and protector of the realm i brienne of tarth sentence you to die do you have any last words : go on do your duty : i don t like leaving you here alone : with jon : not him he seems trustworthy a bit brooding perhaps i suppose it s understandable considering,season two appearances : the north remembers : the night lands : what is dead may never die : garden of bones : the ghost of harrenhal : the old gods and the new : a man without honor : the prince of winterfell : blackwater : valar morghulis : season three appearances : valar dohaeris : dark wings dark words : walk of punishment : and now his watch is ended : kissed by fire : the climb : the bear and the maiden fair : second sons : the rains of castamere : mhysa : season four appearances : two swords : the lion and the rose : breaker of chains : oathkeeper : first of his name : the laws of gods and men : mockingbird : the mountain and the viper : the watchers on the wall : the children : season five appearances : the wars to come : the house of black and white : high sparrow : sons of the harpy : kill the boy : unbowed unbent unbroken : the gift : hardhome : the dance of dragons : mothers mercy : season six appearances : the red woman : home : oathbreaker : book of the stranger : the door : blood of my blood : the broken man : no one : battle of the bastards : the winds of winter,NA,NA,NA,NA,NA,NA,NA,NA
NA,,alive,NA,NA,NA,NA,NA,house payne : brienne of tarth : house stark : house lannister,NA,NA,NA,NA,NA,NA,daniel portman,podrick payne,podrick,there has never lived a more loyal squire : stannis stannis baratheon is coming his whole army,season two appearances : the north remembers : the night lands : what is dead may never die : garden of bones : the ghost of harrenhal : the old gods and the new : a man without honor : the prince of winterfell : blackwater : valar morghulis : season three appearances : valar dohaeris : dark wings dark words : walk of punishment : and now his watch is ended : kissed by fire : the climb : the bear and the maiden fair : second sons : the rains of castamere : mhysa : season four appearances : two swords : the lion and the rose : breaker of chains : oathkeeper : first of his name : the laws of gods and men : mockingbird : the mountain and the viper : the watchers on the wall : the children : season five appearances : the wars to come : the house of black and white : high sparrow : sons of the harpy : kill the boy : unbowed unbent unbroken : the gift : hardhome : the dance of dragons : mothers mercy : season six appearances : the red woman : home : oathbreaker : book of the stranger : the door : blood of my blood : the broken man : no one : battle of the bastards : the winds of winter,NA,NA,NA,NA,NA,NA,NA,NA
NA,,alive,1,NA,NA,NA,horn hill : the reach,night s watch : house tarly,andal,faith of the seven : old gods of the forest,randyll tarly,melessa florent,talla tarly : dickon tarly,gilly,john bradley west,samwell tarly,samwell,i saw it with my own eyes on our way down to castle black he drove a dagger into the walkers heart he risked his own life to save mine more than once hes a greater warrior than either of you will ever be : on the morning of my eighteenth nameday my father came to me you re almost a man now he said but you re not worthy of my land and title tomorrow you re going to take the black forsake all claim to your inheritance and start north if you do not he said then we ll have a hunt and somewhere in these woods your horse will stumble and you ll be thrown from your saddle to die or so i ll tell your mother nothing would please me more : i can t steal her she s a person not a goat : the thing about gilly that you find so interesting is that she said six words to you : and the thing about : that i find so interesting is absolutely nothing : we didn t build 500 miles of ice wall 700 feet high to keep out men the night is gathering maester aemon i ve seen it it s coming for all of us : pyp open the fucking gate : how many brothers can say that they ve killed a white walker and a thenn i might be the first in history : whilst lord janos was hiding with the women and children jon snow was leading ser alliser fought bravely it is true but when he was wounded it was jon who saved us he took charge of the wall s defense he killed the magnar of the thenns he went north to deal with mance rayder knowing that it certainly meant his own death before that he led the mission to avenge lord commander mormont mormont himself chose jon to be his steward he saw something in jon and now we ve all seen it too he may be young but he s the commander we turned to when the night was darkest : oh my : sometimes a man has to make hard choices choices that might look wrong to others but you know are right in the long run : no one touches sam : you may be a coward tarly but you re not stupid,season one appearances : winter is coming : the kingsroad : lord snow : cripples bastards and broken things : the wolf and the lion : a golden crown : you win or you die : the pointy end : baelor : fire and blood : season two appearances : the north remembers : the night lands : what is dead may never die : garden of bones : the ghost of harrenhal : the old gods and the new : a man without honor : the prince of winterfell : blackwater : valar morghulis : season three appearances : valar dohaeris : dark wings dark words : walk of punishment : and now his watch is ended : kissed by fire : the climb : the bear and the maiden fair : second sons : the rains of castamere : mhysa : season four appearances : two swords : the lion and the rose : breaker of chains : oathkeeper : first of his name : the laws of gods and men : mockingbird : the mountain and the viper : the watchers on the wall : the children : season five appearances : the wars to come : the house of black and white : high sparrow : sons of the harpy : kill the boy : unbowed unbent unbroken : the gift : hardhome : the dance of dragons : mothers mercy : season six appearances : the red woman : home : oathbreaker : book of the stranger : the door : blood of my blood : the broken man : no one : battle of the bastards : the winds of winter,NA,NA,NA,sam,NA,NA,NA,NA
NA,NA,alive,NA,NA,NA,NA,craster s keep : beyond the wall : westeros,NA,free folk,NA,craster,NA,morag : sissy : sam : craster s last son : craster s other wives,samwell tarly,hannah murray,gilly,gilly,the thing about gilly that s so interesting is that after all that craster s done to her she s still got hope that life might get better : im not giving it away im giving it to you keep it safe for me til i come back : you know all that from staring at marks on a paper : yes : you re like a wizard,season two appearances : the north remembers : the night lands : what is dead may never die : garden of bones : the ghost of harrenhal : the old gods and the new : a man without honor : the prince of winterfell : blackwater : valar morghulis : season three appearances : valar dohaeris : dark wings dark words : walk of punishment : and now his watch is ended : kissed by fire : the climb : the bear and the maiden fair : second sons : the rains of castamere : mhysa : season four appearances : two swords : the lion and the rose : breaker of chains : oathkeeper : first of his name : the laws of gods and men : mockingbird : the mountain and the viper : the watchers on the wall : the children : season five appearances : the wars to come : the house of black and white : high sparrow : sons of the harpy : kill the boy : unbowed unbent unbroken : the gift : hardhome : the dance of dragons : mothers mercy : season six appearances : the red woman : home : oathbreaker : book of the stranger : the door : blood of my blood : the broken man : no one : battle of the bastards : the winds of winter,craster,NA,NA,sam,NA,NA,NA,NA
lord of harrenhal : lord protector : the vale : master of coin : robert i : joffrey i,,alive,NA,NA,NA,NA,baelish castle : the fingers : the vale of arryn,house baelish,andal : braavosi,NA,baelish,NA,NA,NA,aidan gillen,petyr baelish,petyr,chaos isnt a pit chaos is a ladder many who try to climb it fail and never get to try again the fall breaks them and some are given a chance to climb but refuse they cling to the realm or love or the gods illusions only the ladder is real the climb is all there is : littlefinger was born with no lands no wealth no armies he has acquired the first two how long before he has the army perhaps you ll laugh but i know him better than most and this is the truth littlefinger is one of the most dangerous men in westeros : distrusting me was the wisest thing you ve done since you climbed off your horse : when you find yourself in bed with an ugly woman best close your eyes get it over with cut her throat be done with it : what she doesn t know won t hurt her : a stupid saying what we don t know is usually what get us killed : you know what i learnt losing that duel i learnt that i ll never win not that way that s their game their rules i m not going to fight them i m going to fuck them that s what i know that s what i am and only by admitting what we are can we get what we want : and what do you want : oh everything my dear everything there is : i did warn you not to trust me : i admire you lord baelish a grasper from a minor house with a major talent for befriending powerful men and women : a useful talent i m sure you d agree : those who have the most power have the least grace : look around you we re all liars here and every one of us is better than you : do you know what the realm is it s the thousand blades of aegon s enemies a story we agree to tell each other over and over until we forget that it s a lie : but what do we have left once we abandon the lie chaos a gaping pit waiting to swallow us all : chaos isn t a pit chaos is a ladder many who try to climb it fail and never get to try again the fall breaks them and some are given a chance to climb they cling to the realm or the gods or love only the ladder is real the climb is all there is : always keep your foes confused if they don t know who you are or what you want they can t know what you plan to do next : i don t want friends like me : so many men they risk so little they spend their lives avoiding danger and then they die i d risk everything to get what i want : and what do you want : everything : why did you really kill joffrey tell me why : i loved your mother more than you could ever know given the opportunity what do we do to those who ve hurt the ones we love in a better world one where love could overcome strength and duty you might have been my child but we don t live in that world you re more beautiful than she ever was : lord baelish : call me petyr : oh my sweet wife my sweet silly wife i have only loved one woman only one my entire life your sister : people die at their dinner tables they die in their beds they die squatting over their chamber pots everybody dies sooner or later and don t worry about your death worry about your life take charge of your life for as long as it lasts : there s no justice in this world not unless we make it you loved your family avenge them : we both peddle fantasies brother lancel mine just happen to be entertaining : every time i m faced with a decision i close my eyes and see the same picture whenever i consider a question i ask myself will this action make this picture a reality pull it out of my mind and into the world and i only act if the answer is yes a picture of : on the iron throne and : by my side : news of this battle will spread quickly through the seven kingdoms i ve declared for house stark for all to hear : you ve declared for other houses before lord baelish but it s never stopped you from serving yourself : the past is gone for good you can sit here mourning its departure or you can prepare for the future you my love are the future of house stark who should the north rally behind a trueborn daughter of ned and catelyn stark born here at winterfell or a motherless bastard born in the south : i don t like you lord baelish i don t like your face i don t like the words that come oozing out of your mouth i don t want you in my tent one minute more than necessary so tell me why are you here : is there an idiot in any village who trusts littlefinger : he would see this country burn if he could be king of the ashes,season one appearances : winter is coming : the kingsroad : lord snow : cripples bastards and broken things : the wolf and the lion : a golden crown : you win or you die : the pointy end : baelor : fire and blood : season two appearances : the north remembers : the night lands : what is dead may never die : garden of bones : the ghost of harrenhal : the old gods and the new : a man without honor : the prince of winterfell : blackwater : valar morghulis : season three appearances : valar dohaeris : dark wings dark words : walk of punishment : and now his watch is ended : kissed by fire : the climb : the bear and the maiden fair : second sons : the rains of castamere : mhysa : season four appearances : two swords : the lion and the rose : breaker of chains : oathkeeper : first of his name : the laws of gods and men : mockingbird : the mountain and the viper : the watchers on the wall : the children : season five appearances : the wars to come : the house of black and white : high sparrow : sons of the harpy : kill the boy : unbowed unbent unbroken : the gift : hardhome : the dance of dragons : mothers mercy : season six appearances : the red woman : home : oathbreaker : book of the stranger : the door : blood of my blood : the broken man : no one : battle of the bastards : the winds of winter,lysa arryn,janos slynt : lord of harrenhal,tyrion lannister : master of coin,NA,NA,NA,NA,NA
lord of the eyrie : lord paramount of the vale : warden of the east,,alive,,NA,NA,NA,king s landing : the eyrie,house arryn,andal,NA,jon arryn,lysa arryn,NA,NA,lino facioli,robin arryn,robin,isn t he beautiful and strong too jon knew it his last words were the seed is strong he wanted everyone to know what a good strong boy his son would grow up to be look at him the lord of all the vale : mummy i want to see the bad man fly : what happened next : can i make the little man fly now : not : little man : little man is going home : i wanted to make the little lannister baby man fly but mother said i couldn t,season one appearances : winter is coming : the kingsroad : lord snow : cripples bastards and broken things : the wolf and the lion : a golden crown : you win or you die : the pointy end : baelor : fire and blood : season four appearances : two swords : the lion and the rose : breaker of chains : oathkeeper : first of his name : the laws of gods and men : mockingbird : the mountain and the viper : the watchers on the wall : the children : season five appearances : the wars to come : the house of black and white : high sparrow : sons of the harpy : kill the boy : unbowed unbent unbroken : the gift : hardhome : the dance of dragons : mothers mercy : season six appearances : the red woman : home : oathbreaker : book of the stranger : the door : blood of my blood : the broken man : no one : battle of the bastards : the winds of winter,NA,jon arryn,NA,NA,NA,NA,NA,NA
